{
  "snapshot_id": "FS-6A2E00111ABC",
  "contract_id": "BR-9.26",
  "instrument_id": "BR",
  "timeframe": "1d",
  "ts": "2026-03-16T00:00:00Z",
  "feature_set_version": "gold-v1",
  "regime": "trend",
  "atr": 1.52,
  "ema_fast": 83.15,
  "ema_slow": 82.47,
  "donchian_high": 84.2,
  "donchian_low": 81.6,
  "rvol": 1.18,
  "last_close": 83.3,
  "last_volume": 15230,
  "atr_14": 1.52,
  "natr_14": 1.82,
  "ema_12": 83.15,
  "ema_26": 82.47,
  "sma_20": 82.8,
  "sma_50": 81.9,
  "rsi_14": 57.3,
  "macd": 0.42,
  "macd_signal": 0.31,
  "macd_hist": 0.11,
  "bb_width": 3.2,
  "bb_percent_b": 0.68,
  "adx_14": 22.5,
  "stoch_k": 61.2,
  "stoch_d": 58.7,
  "cci_20": 74.4,
  "willr_14": -31.5,
  "mom_10": 1.4,
  "roc_10": 1.7,
  "mfi_14": 54.8,
  "donchian_position": 0.65,
  "trend_score": 0.45,
  "momentum_score": 0.19,
  "volatility_score": 5.02,
  "volume_pressure": 1.18,
  "supertrend_direction": 1,
  "breakout_state": "inside",
  "features_json": {
    "last_close": 83.3,
    "last_volume": 15230,
    "atr_14": 1.52,
    "natr_14": 1.82,
    "ema_12": 83.15,
    "ema_26": 82.47,
    "sma_20": 82.8,
    "sma_50": 81.9,
    "rsi_14": 57.3,
    "macd": 0.42,
    "macd_signal": 0.31,
    "macd_hist": 0.11,
    "bb_width": 3.2,
    "bb_percent_b": 0.68,
    "adx_14": 22.5,
    "stoch_k": 61.2,
    "stoch_d": 58.7,
    "cci_20": 74.4,
    "willr_14": -31.5,
    "mom_10": 1.4,
    "roc_10": 1.7,
    "mfi_14": 54.8,
    "donchian_position": 0.65,
    "trend_score": 0.45,
    "momentum_score": 0.19,
    "volatility_score": 5.02,
    "volume_pressure": 1.18,
    "supertrend_direction": 1,
    "breakout_state": "inside"
  }
}
